{
  "$schema": "https://json-schema.org/draft/2020-12/schema",
  "$id": "https://raw.githubusercontent.com/baditaflorin/services-registry/main/schema/v1.json",
  "title": "Service Registry Entry v1",
  "type": "object",
  "required": ["id", "name", "category", "kind"],
  "allOf": [
    {
      "if": {
        "properties": {
          "visibility": { "const": "private" }
        },
        "required": ["visibility"]
      },
      "then": {
        "required": ["language", "runtime", "visibility", "cluster", "deployment_mode", "host_port", "container_port"],
        "properties": {
          "deployment_mode": { "const": "iac-rendered" }
        },
        "not": {
          "anyOf": [
            { "required": ["mesh"] },
            { "required": ["url"] },
            { "required": ["health_url"] },
            { "required": ["repo_url"] },
            { "required": ["auth"] },
            { "required": ["auth_help"] },
            { "required": ["example_path"] },
            { "required": ["pages_url"] },
            { "required": ["pages_source_branch"] },
            { "required": ["cert_domain"] },
            { "required": ["alias_urls"] },
            { "required": ["extra_server_names"] },
            { "required": ["vhost"] },
            { "required": ["network_exposure"] }
          ]
        }
      },
      "else": {
        "required": ["mesh", "url", "health_url", "repo_url", "auth"]
      }
    }
  ],
  "properties": {
    "id":           { "type": "string", "pattern": "^[a-z][a-z0-9-]*$", "description": "Stable slug; kebab-case; unique across all meshes" },
    "name":         { "type": "string", "description": "Human display name" },
    "description":  { "type": "string", "description": "One-line summary" },
    "category":     { "type": "string", "description": "One of: proxy, search, ocr, geo, nlp, content, domains, security, recon, infrastructure, web_analysis, visualization, registry, dashboard" },
    "mesh":         { "type": "string", "enum": ["0exec", "0crawl", "0docker", "pages", "custom"], "description": "Which service mesh / domain root" },
    "kind": {
      "type": "string",
      "enum": ["container", "static"],
      "description": "What kind of deployable this is. Orthogonal to mesh. 'container' = runs as a Docker service on the dockerhost (has host_port, container_port, /health, Dockerfile, deploy.yaml, LXC workspace). 'static' = static GitHub Pages site (no port, no container, no workspace, no /health). fleet-runner gates kind-specific operations on this field — kind=static is skipped by health/smoke/deploy/clone-missing/audit-port/bump-version/update-dep."
    },
    "language": {
      "type": "string",
      "enum": ["go", "node", "python", "rust", "c", "html", "wasm", "other"],
      "description": "Primary implementation language. For kind=container this drives bulk-operation filters (e.g. 'update-dep' only touches go services). For kind=static it is informational. Default for legacy 0exec/0crawl entries is 'go'; default for pages is 'html'."
    },
    "runtime": {
      "type": "string",
      "enum": ["compose", "systemd", "binary", "k8s", "github-pages", "external"],
      "description": "How the service is started/managed. Orthogonal to kind and language — gates deploy logic (compose: `docker compose up -d`; systemd: `systemctl restart`; github-pages: trigger Pages rebuild). Default for kind=container is 'compose'; default for kind=static is 'github-pages'. Adding a new runtime is how the fleet absorbs deployment shapes without forking every audit."
    },
    "visibility": {
      "type": "string",
      "enum": ["public", "private"],
      "description": "Public is the default catalog and gateway lane. Private is an explicit direct-mTLS deployment lane: its record must omit all URL, auth, endpoint, and source-location fields, declare cluster=0mcp, and is excluded from every catalog/projection output."
    },
    "cluster": {
      "type": "string",
      "description": "Explicit runner placement target. Private services must declare the only approved private cluster, 0mcp; endpoint transport details are held in root-owned Builder state rather than this registry."
    },
    "deployment_mode": {
      "type": "string",
      "description": "Deployment lifecycle owner. Private services must declare iac-rendered so generic fleet-runner compose deployment fails before it can modify runtime state."
    },
    "lifecycle": {
      "type": "object",
      "required": ["status"],
      "properties": {
        "status": { "type": "string", "enum": ["active", "sunset"] },
        "sunset_at": { "type": "string", "format": "date" },
        "reason": { "type": "string", "minLength": 1 },
        "successor": { "type": "string" }
      },
      "allOf": [{
        "if": { "properties": { "status": { "const": "sunset" } }, "required": ["status"] },
        "then": { "required": ["sunset_at", "reason"] }
      }],
      "additionalProperties": false,
      "description": "Service lifecycle. Sunset records remain in the catalog as tombstones; fleet-runner refuses deployment and MCP discovery excludes them."
    },
    "tags":         { "type": "array", "items": { "type": "string" } },
    "url":          { "type": "string", "format": "uri", "description": "Public base URL of the service, no trailing slash" },
    "health_url":   { "type": "string", "format": "uri" },
    "repo_url":     { "type": "string", "format": "uri", "description": "GitHub source repository" },
    "example_path": { "type": "string", "description": "Path + query that produces a real response; begins with '/'. Example: '/?url=https://example.com'. May be empty if the service has no canonical example." },
    "auth": {
      "type": "object",
      "required": ["type"],
      "properties": {
        "type": { "type": "string", "enum": ["api_key", "none"] },
        "header":             { "type": "string", "description": "auth=api_key: HTTP header carrying the service API key (e.g. 'X-API-Key')" }
      }
    },
    "auth_help": {
      "type": "string",
      "description": "Canonical short label for what auth a caller needs. Computed by generate.py from the auth object. UIs render verbatim — do NOT re-derive in JS/templates (that's what produced the historical 'No auth' bug on api_key services)."
    },
    "pages_url": {
      "type": "string", "format": "uri",
      "description": "kind=static only. Canonical GitHub Pages URL. For kind=container this field MUST NOT be set."
    },
    "pages_source_branch": {
      "type": "string",
      "description": "kind=static only. Branch the Pages build is served from (typically 'main' or 'gh-pages'). Informational for the catalog UI."
    },
    "port": { "type": "integer", "description": "DEPRECATED — ambiguous (host vs container). Use host_port / container_port instead." },
    "host_port": {
      "type": "integer", "minimum": 1, "maximum": 65535,
      "description": "Port bound on the dockerhost. This is what the gateway nginx proxy_pass points at. Single source of truth for IaC rendering. See private fleet-state/OPS.md for the dockerhost address."
    },
    "container_port": {
      "type": "integer", "minimum": 1, "maximum": 65535,
      "description": "Port the service listens on INSIDE the container. Informational; not used by gateway routing."
    },
    "internal_direct": {
      "type": "boolean",
      "description": "Internal consumer-routing capability. True means a reviewed fleet consumer may call this service directly at host_port on the private fleet network, bypassing the public gateway and consumer-side proxy. Absent or false is deny-by-default. Internal only; excluded from services-public.json."
    },
    "trl": {
      "type": "integer", "minimum": 1, "maximum": 9,
      "description": "Technology Readiness Level achieved. 1-3 toy, 4-5 developing, 6-7 real, 8-9 production. Optional; absence means not yet assessed."
    },
    "trl_evidence": {
      "type": "string",
      "description": "One-line justification for the TRL number (what concretely makes it that level)."
    },
    "trl_ceiling": {
      "type": ["integer", "null"], "minimum": 1, "maximum": 9,
      "description": "Maximum TRL realistically achievable with CPU-only smart logic + free public data. Null means no known ceiling. Repos with low ceilings are deprecation candidates."
    },
    "trl_ceiling_reason": {
      "type": ["string", "null"],
      "description": "One-line reason for the ceiling (e.g. 'needs libpostal trained data', 'requires DOM canary injection', 'wraps paid threat intel feeds')."
    },
    "trl_assessed_at": {
      "type": "string", "format": "date",
      "description": "ISO date the TRL was last evaluated. Re-assess if older than ~90 days."
    },
    "trl_assessor": {
      "type": "string",
      "description": "Who/what assessed: 'claude-session-YYYY-MM-DD' for AI-assisted, 'human' for manual review."
    },
    "placement": {
      "type": "string",
      "enum": ["pinned", "replicable"],
      "description": "Whether this service is a safe dynamic-placement candidate. See ADR-0039. 'pinned' = holds state that doesn't trivially move with it (a data volume, a database, anything where starting it elsewhere loses or orphans data) — never route dynamically as-is. 'replicable' = safe to start on any capacity-eligible host. Optional, same convention as `trl`: absence means not yet assessed, NOT a default of either value — do not assume unset means replicable just because most kind=container entries are. Declared per-slug in overrides.json."
    },
    "quality_contract": {
      "type": "object",
      "description": "Private, machine-readable label-quality contract for extraction/classification services. Declares the reproducible public golden dataset, regression command, and the most recent precision/recall evidence. Absent means the service has not yet been quality-gated; it is never a claim of quality by default.",
      "required": ["status", "dataset_url", "regression_command", "last_verified_at"],
      "properties": {
        "status": { "type": "string", "enum": ["declared", "operational"], "description": "'operational' requires the regression command to be executed in CI against the pinned dataset revision; 'declared' is documentation only and cannot be used as an evidence signal." },
        "dataset_url": { "type": "string", "format": "uri", "description": "Public, stable source or repository URL for the golden data." },
        "dataset_revision": { "type": "string", "description": "Pinned source revision, release date, checksum, or immutable commit." },
        "regression_command": { "type": "string", "minLength": 1, "description": "Repository-relative command that runs the golden-data regression without production credentials." },
        "metrics": { "type": "array", "items": { "type": "string", "enum": ["precision", "recall", "f1", "coverage", "false_positive_rate", "false_negative_rate"] }, "uniqueItems": true },
        "last_verified_at": { "type": "string", "format": "date", "description": "Date the declared command and dataset revision last passed." },
        "evidence": { "type": "string", "description": "Short result summary; must name known label gaps rather than imply unmeasured quality." }
      },
      "additionalProperties": false
    },
    "depends_on": {
      "type": "array",
      "items": { "type": "string", "pattern": "^[a-z][a-z0-9_-]*$" },
      "uniqueItems": true,
      "description": "Declared service-to-service dependencies (slugs). Static counterpart to the live edges in go-fleet-graph. fleet-runner audit-graph diffs declared vs observed: declared-not-observed = dead dep (remove) or broken caller; observed-not-declared = undeclared coupling (add or refactor). Optional; absence means 'no declared deps yet'. Edges to non-fleet hosts go in tags, not here."
    },
    "graph_target_hosts": {
      "type": "array",
      "items": {
        "type": "string",
        "pattern": "^(?=.{1,253}$)(?:[a-z0-9](?:[a-z0-9-]{0,61}[a-z0-9])?\\.)+[a-z]{2,63}$"
      },
      "uniqueItems": true,
      "description": "Exact public hostnames that identify this service when bounded runtime graph telemetry reports an external:<host> destination. Telemetry canonicalization only; this field does not configure DNS, TLS, or gateway routing."
    },
    "owner": {
      "type": "object",
      "description": "Who is responsible for this service. F4 phase 1 — OPTIONAL while the fleet backfills organically; track compliance via 'fleet-runner audit service-yaml-schema --field owner'. INTERNAL ONLY: not exposed in services-public.json (not added to PUBLIC_FIELDS).",
      "required": ["name", "contact"],
      "properties": {
        "name":    { "type": "string", "description": "Individual or team name. Free-form (e.g. 'Florin', 'platform-team')." },
        "contact": { "type": "string", "description": "Canonical contact — email, slack handle, mailing list." },
        "github":  { "type": "string", "description": "Optional GitHub login used as default assignee for issues / PRs auto-filed against this service." }
      }
    },
    "mcp_ready": {
      "type": "boolean",
      "description": "True if this service serves a live GET /agent.json and is currently aggregated into go-fleet-mcp-gateway's MCP tool list. Set by bin/audit_mcp_ready.py from the gateway's own GET /gateway/tools — never hand-set. Absence means not yet assessed or not currently reachable; false is not written, only true (see services.mcp.json)."
    },
    "mcp_tool_count": {
      "type": "integer", "minimum": 0,
      "description": "How many MCP tools this service currently contributes to the gateway's aggregation. Companion to mcp_ready."
    },
    "mcp_assessed_at": {
      "type": "string", "format": "date-time",
      "description": "Timestamp of the audit_mcp_ready.py run that last confirmed mcp_ready."
    },
    "allowed_source_ips": {
      "type": "array",
      "minItems": 1,
      "uniqueItems": true,
      "items": {
        "type": "string",
        "pattern": "^(?:(?:(?:25[0-5]|2[0-4][0-9]|1[0-9]{2}|[1-9]?[0-9])\\.){3}(?:25[0-5]|2[0-4][0-9]|1[0-9]{2}|[1-9]?[0-9])/32|[0-9A-Fa-f:]+/128)$"
      },
      "description": "Operational additional source allow rules for a gateway-ip-allowlisted service. Entries must be exact-host IPv4 /32 or IPv6 /128 CIDRs; these are additive and do not replace standard renderer allow rules. Kept out of services-public.json."
    },
    "gateway_rate_limit": {
      "type": "string",
      "enum": ["api_per_ip", "allowlisted-sources-exempt"],
      "description": "Gateway per-IP rate limit on the vhost's catchall location. Absent or 'api_per_ip' renders limit_req zone=api_per_ip. 'allowlisted-sources-exempt' renders none and is valid only for a keystore-gated, network_exposure='gateway-ip-allowlisted' service, whose allow/deny block admits fleet hosts alone; a remote runtime host sends all of its pool replicas from one egress address, so a per-IP bucket throttled them against each other. Kept out of services-public.json."
    },
    "served_by": {
      "type": "string",
      "minLength": 1,
      "description": "Name of the other deployment that actually answers for this entry (e.g. 'domainscope'). The gateway routes the entry's vhost to it through the private upstream map in fleet-state/nginx-upstreams.json, so no container is expected from this entry's host_port on the docker hosts; host_port stays a reserved claim only. Container audits and the /selftest poller skip the dockerhost check for entries that set it. A name, never a URL: gateway upstreams are private deployment policy and must not be generated from the public catalog. Not in PUBLIC_FIELDS (allowlist), so excluded from services-public.json."
    },
    "network_exposure": {
      "type": "string",
      "enum": ["loopback", "lan-internal", "gateway-ip-allowlisted", "gateway-authenticated", "gateway-public"],
      "description": "How reachable this service actually is, computed by bin/generate.py from cert_domain/auth.type/scope (see compute_network_exposure) — not hand-declared for entries with a rendered vhost, so it can't drift from what nginx-render actually emits. 'loopback' = 127.0.0.1-only, unreachable even fleet-wide. 'lan-internal' = host-network/0.0.0.0-bound, reachable over the private LAN but never proxied through nginx (no vhost, no public DNS) — set via a manual overrides.json override since the registry alone can't distinguish this from loopback. 'gateway-ip-allowlisted' = public vhost + DNS, gated only by an nginx IP allowlist (successor to the old `scope: internal-only` flag). 'gateway-authenticated' = public vhost + DNS, keystore auth_request-gated (the common case). 'gateway-public' = public vhost + DNS, auth.type=none, genuinely open. Absent for kind=static (not a listening service). Excluded from services-public.json — see PUBLIC_FIELDS in bin/generate.py."
    }
  },
  "additionalProperties": false
}
